,Summary,top_terms
0,"Wal-Mart, the largest US retailer, has said its December sales are expected to be better than previously forecast because of strong post-Christmas sales.""The continuing economic expansion, combined with job growth, has consumers ending this year on a high note,"" said Lynn Franco, director of the Conference Board's consumer research centre.The feel-good factor among US consumers rose in December for the first time since July according to new data.Consumers' confidence in the state of the US economy is at its highest for five months and they are optimistic about 2005, an influential survey says.US retailers have reported strong sales over the past 10 days after a slow start to the crucial festive season.","['job', 'board', 'survey', 'december', 'conference', 'economic', 'consumer', 'sales', 'confidence', 'consumers']"
1,"Brute force budget cuts or spending caps would ill-serve the nation's elderly and indigent.News coverage of the Bush budget will be dominated by debates about spending cuts, but the fact is these will be large cuts in small programs.Without major changes in current policies and political prejudices, the federal budget simply cannot hold together.The budget proposals laid out by the administration of US President George W Bush are highly controversial.Federal revenues are at 1950s levels, while spending remains where it has been in recent decades - much higher.Indeed, if Congress were rash enough to balance the budget in this way, there would hardly be any such spending left.The US Government cannot finance its operations without heavy borrowing from the central banks of Japan and China, among other nations.One thing is certain - destroying the budget in order to save it is not going to equip the US economy and government for the challenges of this new century.This upward trend will force increased borrowing by the federal government, putting upward pressure on interest rates faced by consumers and business.Reducing domestic spending, or eliminating ""waste, fraud and abuse"" is toothless because this slice of the budget is too small to solve the problem.The biggest spending growth areas are defence (including homeland security), and health care for the elderly and the poor.Savings in health care spending that do not come at the expense of health can only be achieved with wholesale reform of the entire system, public and private.Even now, a growing share of US borrowing is from abroad.US politicians and citizens of all political persuasions are in for a dose of shock therapy.Under direct threat will be the federal government's ability to make good on its debts to the Social Security Trust Fund.By definition, the deficit means too little revenue and too much spending - but this neutral description doesn't adequately capture the current situation.The trigger for the coming shock will be rising federal debt, which will grow in 10 years, by conservative estimates, to more than half the nation's total annual output.From the standpoint of the big fiscal trends, the cuts are gratuitous and the big budget train wreck is yet to come.The US population is aging, and the nation does face genuine threats in the world.There will be no need for constitutional amendments to balance the budget.","['reform', 'tax', 'revenue', 'bush', 'health', 'small', 'federal', 'cuts', 'spending', 'budget']"
2,"Trouble-hit Mitsubishi Motors is in talks with French carmaker PSA Peugeot Citroen about a possible alliance.On Tuesday Mitsubishi, the only major Japanese car firm in the red, confirmed earlier reports of negotiations.But a spokesman refused to comment on speculation that Mitsubishi could end up building cars for PSA and perhaps its Japanese rival Nissan.Mitsubishi has been hit by a recall scandal and the withdrawal of support from shareholder DaimlerChrysler.","['scandal', 'carmaker', 'french', 'vehicles', 'sales', 'hit', 'talks', 'japanese', 'shareholder', 'mitsubishi']"
3,"Typically it takes about three years from when a decision is taken before a new model hits the streets, Mr Panke said, implying that a BMW crossover could be on the market by 2008.""We have decided that BMW will enter the [crossover] segment,"" he said in the clearest indication yet about the car maker's intentions.""We have decided that the BMW brand will enter the segment,"" he said.While in the US drivers tend to prefer sports utility vehicles (SUVs), such as the BMW X5 and its sibling X3, in Europe demand for crossover vehicles is likely to be considerable, Mr Panke said.""There's a growing market here,"" he said.Speaking at a BMW event ahead of the Geneva motor show, Helmut Panke predicted demand for such crossover vehicles would soar in Europe.","['demand', 'new', 'europe', 'decision', 'mr', 'said', 'market', 'car', 'enter', 'vehicles']"
4,"More than 2,000 business and political leaders from around the globe are arriving in the Swiss mountain resort Davos for the annual World Economic Forum (WEF).But much of the media focus will be on the political leaders coming to Davos, not least because the agenda of this year's forum seems to lack an overarching theme.The Brazilian city of Porto Alegre will host the rival World Social Forum, timed to run in parallel with the WEF's ritzier event in Davos.Mr Gates' company, software giant Microsoft, also hopes to use Davos to shore up its defences against open source software like Linux, which threaten Microsoft's near monopoly on computer desktops.However, many of the issues discussed in Porto Alegre are Davos talking points as well.UK Prime Minister Tony Blair and South African President Thabo Mbeki are among the more than 20 government leaders and heads of state leaders attending the meeting.Davos fans still hark back to 1994, when talks between Yassir Arafat and Mr Peres came close to a peace deal.Microsoft founder Bill Gates, the world's richest man and a regular at Davos, will focus on campaigning for good causes, though business interests will not be wholly absent either.The US government may still make a conciliatory gesture, just as happened a year ago when Vice President Dick Cheney made a surprise appearance in Davos.Davos itself is in deep frost.Mr Gates is said to be trying to arrange a meeting with Brazil's President Lula da Silva.Having already donated billions of dollars to the fight against Aids and Malaria, Mr Gates will call on world leaders to support a global vaccination campaign to protect children in developing countries from easily preventable diseases.At Davos, global problem solving and networking are never far apart.","['global', 'swiss', 'government', 'issues', 'world', 'political', 'mr', 'president', 'leaders', 'davos']"
5,"Madagascar has completed the replacement of its Malagasy franc with a new currency, the ariary.The ariary was the name of a pre-colonial currency in the Indian Ocean island state.The phasing out of the franc, begun in July 2003, was intended to distance the country from its past under French colonial rule and address the problem of the large amount of counterfeit francs in circulation.From Monday, all prices and contracts will have to be quoted in the ariary, which was trading at 1,893 to the US dollar.","['problem', 'pre', 'longer', 'rule', 'completed', 'distance', 'contracts', 'quoted', 'french', 'currency']"
6,"The US stock market regulator is investigating troubled insurance broker Marsh & McLennan's shareholder transactions, the firm has said.Marsh has said it is co-operating fully with the SEC investigation.Marsh is also the focus of an inquiry the New York attorney-general into whether insurers rigged the market.Since that inquiry was launched in October, Marsh has replaced its chief executive and held a boardroom shake-out to meet criticism by lessening the number of company executives on the board.Prosecutors allege that Marsh - the world's biggest insurance broker - and other US insurance firms may have fixed bids for corporate cover.The uncertainty unleashed by the scandal has prompted three credit rating agencies - Standard & Poor's, Moody's and Fitch - to downgrade Marsh in recent weeks.","['investigation', 'scandal', 'troubled', 'insurers', 'sec', 'inquiry', 'transactions', 'insurance', 'spitzer', 'marsh']"
7,"Shares in India's largest power producer, National Thermal Power Corp (NTPC) have risen 13% on their stock market debut.""Power needs in India are set to rise and NTPC will benefit from that.""NTPC has said it will use the money from the share sale to feed the growing needs of the country's energy-starved economy.Analysts say the success of the NTPC flotation would encourage the government to reduce stakes in more power companies.","['stock', 'government', 'offer', 'shares', 'needs', 'largest', 'producer', 'share', 'india', 'power']"
8,"Despite its string of bad luck, he pointed out, Aurora is just one vessel in a large Carnival fleet, the UK's P&O Princess group having been merged into the much larger US firm in 2003.And with Carnival remaining the market leader, it looks set to keep selling the tickets - no matter what happens to the ill-fated Aurora in the future.Similarly, analysts expect the impact on the rest of the cruise business to be limited.After all, the Aurora incident may be big news in the UK - but for Carnival customers elsewhere it's unlikely to make too much of a splash.And generally speaking, Carnival has a reputation for keeping its ships pretty much on schedule.And its owner, P&O Cruises - now part of the huge US Carnival Corporation - was looking at a significant slice chopped off this year's profits and a potential PR fiasco.In the wake of P&O Princess's takeover by Carnival, the business is now to a great extent a duopoly.""The Aurora issue had been an ongoing one for some time,"" says Deutsche Bank's Simon Champion.""Carnival has an incredibly strong track record,"" Mr Champion.In other words, if you do want a cruise, your options are limited.","['industry', 'stock', 'just', 'future', 'impact', 'market', 'bad', 'citigroup', 'limited', 'carnival']"
9,"The National Statistic Institute (INSEE) added that consumer spending in January rose 3.8% on a year-on-year basis.The INSEE also said that French consumer prices fell 0.6% in January, but were up 1.6% on an annual basis.Despite the general increase in spending in January, French households bought fewer cars in January.French consumers increased their spending by 1.5% in January, a figure which bodes well for the country's economic growth, figures revealed.According to the INSEE, car sales fell 2.8% in January, following a fall of 0.6% in December.","['sales', 'increase', 'rose', '06', 'confidence', 'basis', 'spending', 'january', 'french', 'consumer']"
10,"US oil prices have fallen by 6%, driven down by forecasts of a mild winter in the densely populated northeast.Statistics released last week showed that stockpiles of oil products in the US had risen, an indication that severe supply disruptions may not arise this winter, barring any serious incident.Oil prices have broken records in 2004, topping $50 a barrel at one point, driven up by a welter of worries about unrest in Iraq and Saudi Arabia, rising demand and supply bottlenecks.Light crude oil futures fell $2.86 to $41.32 a barrel on the New York Mercantile Exchange (Nymex), and have now lost $4 in five days.Nonetheless, US crude is still 30% more expensive than at the beginning of 2004, boosted by growing demand and bottlenecks at refineries.","['saudi', 'prices', 'demand', 'exchange', 'driven', 'supply', 'crude', 'barrel', 'winter', 'oil']"
11,"A US firm has said it is in final negotiations with luxury goods group LVMH to buy the loss-making Christian Lacroix haute-couture house.But one of the three brothers behind the Falic Group said the firm had also held talks with the designer Christian Lacroix, and wished to retain him.Privately-held Falic Group bought two cosmetics brands, Hard Candy and Urban Decay, from LVMH in early 2003.Paris-based LVMH has been selling non-core businesses and focusing on its most profitable labels including Moet & Chandon champagne and Louis Vuitton.","['comment', 'final', 'brand', 'stores', 'profitable', 'bids', 'increase', 'firm', 'group', 'held']"
12,"Meanwhile, drugs group Eli Lilly is planning a campaign against ""false"" claims about its product Prozac.Meanwhile Eli Lilly is launching a series of adverts in a dozen major newspapers, to present what is says are the true facts about its anti-depressant drug Prozac.Wal-Mart kicked off the battle with adverts in newspapers like the Wall Street Journal, using an open letter from company president Lee Scott saying it was time for the public to hear the ""unfiltered truth"".Eli Lilly's chief medical officer Alan Breier said that the article was ""false and misleading"" as the documents it referred to were actually created by officials at the US Food and Drug Administration (FDA) and presented to an FDA meeting in 1991.""I think they are going to have a tough time suddenly overcoming the perceptions of some people,"" said Larry Bevington, chairman of Save Our Community - a group fighting to prevent Wal-Mart opening a store in Rosemead, California.The world's biggest retailer Wal-Mart took out more than 100 full page adverts in national newspapers.Wal-Mart's average pay is almost twice the national minimum wage of $5.15 (£3.90) an hour, while employees are offered health and life insurance, company stock and a retirement plan, the adverts say.""It was simply wrong to suggest that information on Prozac was missing, or that important research data on the benefits and possible side effects of the drug were not available to doctors and regulators,"" the letter added.","['open', 'employees', 'allegations', 'missing', 'good', 'group', 'benefits', 'drug', 'mart', 'wal']"
13,"While pinpointing several areas in which there are difficulties in the bilateral and multilateral work with Russia, the US said the meeting was ""much more efficient than we've seen for some time"".Mr Johannesson also said progress ""on the bilateral market access side is accelerating"".His comments came as President George W Bush said the US backed Russian entry.But he said for Russia to make progress the government must ""renew a commitment to democracy and the rule of law"".Talks on Russia's proposed membership of the World Trade Organisation (WTO) have been ""making good progress"" say those behind the negotiations.Some WTO members also dislike Russia's energy price subsidies, which competitors say give Russian businesses an unfair advantage.","['talks', 'members', 'russian', 'kong', 'comments', 'hong', 'membership', 'progress', 'russia', 'wto']"
14,"Swiss drugmaker Novartis has announced 5.65bn euros ($7.4bn; £3.9bn) of purchases to make its Sandoz unit the world's biggest generic drug producer.Novartis said that it would be able to make cost savings of about $200m a year following the acquisitions.Novartis said that it would merge a number of departments, adding that there may be job cuts.The deal will see Novartis' Sandoz business overtake Israel's Teva Pharmaceuticals as the world's biggest maker of generics.Novartis, which last month forecast record sales for 2005, said it had bought all of Germany's Hexal.Novartis' shares rose 1% to 57.85 Swiss francs in early trading.","['world', 'shares', 'drug', 'biggest', 'deal', 'sales', 'make', 'cost', 'producer', 'swiss']"
15,"EBay now forecasts 2005 revenue of $4.2bn to $4.35bn and earnings excluding items of $1.48 to $1.52 per share.Analysts had previously estimated that eBay would achieve 2005 revenues of $4.37bn and earnings of $1.62 per share, excluding items.For 2004 as a whole, eBay earned $778.2m on sales of $3.27bn.Excluding special items, eBay's profit was 33 cents a share, but analysts had expected 34 cents.""I think Wall Street has gotten a bit ahead of eBay this quarter and for the 2005 year.""","['fell', 'profit', 'earnings', 'revenue', 'net', 'share', '2005', 'street', 'wall', 'ebay']"
16,"During cross examination, he asked Mr Myers if he ever knew Mr Ebbers ""make an accounting decision?"".""Not that I am aware of,"" Mr Myers replied.""Did you ever know Mr Ebbers to make an accounting entry into Worldcom books?""Mr Myers has admitted that he ordered false accounting entries at the request of former Worldcom chief financial officer Scott Sullivan.David Myers made the comments under questioning by defence lawyers who have been arguing that Mr Ebbers was not responsible for Worldcom's problems.Defence lawyers have been trying to paint Mr Sullivan, who has admitted fraud and will testify later in the trial, as the mastermind behind Worldcom's accounting house of cards.Mr Myers has already pleaded guilty to fraud and is assisting prosecutors.Former Worldcom boss Bernie Ebbers, who is accused of overseeing an $11bn (£5.8bn) fraud, never made accounting decisions, a witness has told jurors.","['books', 'guilty', 'sullivan', 'fraud', 'boss', 'defence', 'accounting', 'mr', 'ebbers', 'worldcom']"
17,"Shares in US phone company MCI have risen on speculation that it is in takeover talks.The Wall Street Journal reported on Thursday that Qwest has bid $6.3bn (£3.4bn) for MCI.Shares in MCI, which changed its name from Worldcom when it emerged from bankruptcy, were up 2.4% at $20.15.Competition has intensified and fixed-line phone providers such as MCI and AT&T have seen themselves overtaken by rivals.Buying MCI would give Qwest, a local phone service provider, access to MCI's global network and business-based subscribers.The largest US telephone company Verizon has previously held preliminary merger discussions with MCI, Reuters quoted sources as saying.Other firms have also expressed an interest in MCI, the second-largest US long-distance phone firm, and may now table rival bids, analysts said.","['bankruptcy', 'takeover', 'rival', 'shares', 'merger', 'bids', 'worldcom', 'qwest', 'phone', 'mci']"
18,"Separately, the SEC said it had reached a $140m deal - equally split between penalties and compensation - in its probe into Columbia Management Advisors (CAM) and Columbia Funds Distributor (CFD) and three ex-Columbia executives.The SEC also said it had brought fraud charges against two ex-senior executives of Columbia Distributor.Columbia Distributor was part of FleetBoston, bought by BOA last year.Three other ex-Columbia executives agreed settlements with the SEC.The SEC has set itself the task of stamping out the mutual funds' use of market-timing, a form of quick-fire, short-term share trading that harms the interests of small investors, with whom mutual funds are particularly popular.The SEC unveiled two separate settlements, one covering BOA's direct subsidiaries, and another for businesses that were part of FleetBoston at the time.The SEC agreed a deal totalling $375m with Banc of America Capital Management, BACAP Distributors and Banc of America Securities.In both cases, it said there had been secret deals to engage in market timing in mutual fund shares.","['bank', 'gains', 'paid', 'settlement', 'agreed', 'america', 'executives', 'ex', 'funds', 'sec']"
19,"LG Card had been threatened with collapse because of its huge debts but the firm's creditors and its former parent have stepped in to rescue it.South Korea's largest credit card firm has averted liquidation following a one trillion won ($960m; £499m) bail-out.The firm's creditors - which own 99% of LG Card - have been trying to agree a deal to secure its future for several weeks.LG Card returned to profit in September but needed further capital to avoid being thrown off the market.LG Card has seven million customers and its collapse would have sent shockwaves through the country's economy.""LG Card will not need any more financial aid after this,"" Laah Chong-gyu, executive director of Korea Development Bank - one of the firm's creditors - said.","['avoid', 'collapse', 'south', 'credit', 'firm', 'debt', 'korea', 'creditors', 'lg', 'card']"
20,"The IMF will also reduce its growth estimate for the 12-member eurozone economy from 2.2% to 1.6%, the newspaper reported.The IMF's draft World Economic Outlook - due to be published in April - would point to a marked deterioration in Germany's economy, the FT report said.In September, the IMF had said that German growth for the current year would be 1.8%.The IMF has also revised eurozone forecasts, the paper said, taking into account high oil prices, the strength of the euro and weak demand in many of the world's leading economies.","['world', 'economic', '18', 'newspaper', 'estimate', 'growth', 'economy', 'german', 'eurozone', 'imf']"
21,"And ILO-based figures also suggest that 14,000 new net jobs were created that month, taking the number of people employed to 38.9 million.Using the most internationally-accepted methodology of the International Labour Organisation (ILO), Germany had 3.97 million people out of work in January.Adjusted for seasonal changes, the overall unemployment rate is 4.875 million people or 11.7%, up 0.3 percentage points from the previous month.More than 5.2 million Germans were out of work in February, new figures show.The figure of 5.216 million people, or 12.6% of the working-age population, is the highest jobless rate in Europe's biggest economy since the 1930s.The soaring official unemployment figure follows a change in the methodology which pushed up the jobless rate by more than 500,000 in January.","['january', 'labour', 'schroeder', 'rate', 'work', 'jobless', 'people', 'german', 'million', 'unemployment']"
22,"Ms Druyun had talks with Mr Sears in October 2002 about working for Boeing, while she was still a top procurement official within the Pentagon.Mr Sears told prosecutors that no other Boeing officials were aware that Ms Druyun was still responsible for major procurement decisions at the time she was discussing a job with Boeing.Boeing sacked Mr Sears and Ms Druyun in November 2003 after allegations that they had violated company recruitment policy.Ms Druyun admitted that she had steered multi-billion dollar contracts to Boeing and other favoured companies.The Pentagon subsequently revoked $1bn worth of contracts assigned to Boeing and prohibited the Seattle-based company from future rocket work.Boeing lost a $23bn government contract after a Pentagon inquiry into the case.Ms Druyun is currently serving a nine month sentence for favouring Boeing when awarding lucrative contracts.Boeing was sued by Lockheed Martin after its rival accused it of industrial espionage during a 1998 contract competition.","['ex', 'prosecutors', 'air', 'allegations', 'contract', 'pentagon', 'contracts', 'ms', 'druyun', 'boeing']"
23,"In the fourth quarter alone Ford reported net income of $104m, compared with a loss of $793m a year ago.Ford, the US car company, reported higher fourth quarter and full-year profits on Thursday boosted by a buoyant period for its car loans unit.Though car and truck loan profits saved the day, Ford's auto unit made a pre-tax loss of $470m in the fourth quarter (compared to a profit of £13m in the year-ago period) and its US sales dipped 3.8%.Fourth quarter turnover was $44.7bn, compared to $45.9bn a year ago.Total company vehicle unit sales in 2004 were 6,798,000, an increase of 62,000 units from 2003.Recent new models introduced by Ford include the Ford Five Hundred and Mercury Montego sedans, the Ford Freestyle crossover, the Ford Mustang, the Land Rover LR3/Discovery, and Volvo S40 and V50 in North America and Europe.In addition, the company said 2004 net income was affected by a fourth-quarter pre-tax charge taken to reduce the value of a receivable owed to Ford by Visteon, a former subsidiary.But Ford declined to provide guidance for first quarter 2005.","['pre', 'loss', 'vehicle', 'income', 'models', 'ago', 'unit', 'quarter', 'fourth', 'ford']"
24,"Mr Bush, however, has said the best way to halt the dollar's slide is to deal with the US deficit.US president George W Bush has pledged to introduce a ""tough"" federal budget next February in a bid to halve the country's deficit in five years.""We will submit a budget that fits the times,"" Mr Bush said.The US budget and its trade deficit are both deep in the red, helping to push the dollar to lows against the euro and fuelling fears about the economy.Mr Bush indicated there would be ""strict discipline"" on non-defence spending in the budget.","['deal', 'hit', 'term', 'federal', 'mr', 'tough', 'dollar', 'budget', 'bush', 'deficit']"
25,"Yangtze Electric Power, the operator of China's Three Gorges Dam, has said its profits more than doubled in 2004.The Three Gorges Dam project has led to more than half a million people being relocated and drawn criticism from environmental groups and overseas human rights activists.Yangtze Electric has been expanding its output to meet demand driven by China's booming economy.The firm has benefited from increased demand for electricity at a time when power shortages have hit cities and provinces across the country.Earlier this month, work was halted on an underground power station, and a supply unit on the Three Gorges Dam, as well as a power station on its sister Xiluodu dam because of environmental worries.Sales surged to 6.2bn yuan, from 3bn yuan a year earlier.","['china', 'led', 'supply', 'demand', 'project', 'environmental', 'yuan', 'yangtze', 'power', 'dam']"
