,Summary,top_terms
131,"The paper said Chinese officials had been irritated by Rover's disclosure of its talks with Shanghai Automotive Industry Corp in October.According to the FT, the regulator has been annoyed by Rover's decision to talk publicly about the deal and the intense speculation which has ensued about what it will mean for Rover's future.The proposed deal was seen as crucial to safeguarding the future of Rover's Longbridge plant in the West Midlands.According to the Observer, 3,000 jobs - out of a total workforce of 6,500 - could be lost if the deal goes ahead.The paper said that Chinese officials believe cutbacks will be required to keep the MG Rover's costs in line with revenues.As a result, hopes that approval of the deal may be fast-tracked have disappeared, the paper said.","['officials', 'according', 'result', 'speculation', 'plant', 'approval', 'models', 'deal', 'chinese', 'rover']"
132,"India's government has given its backing to cheaper and more accessible air travel.When it was set up the firm offered tickets that were 50% cheaper than other Indian airlines.Air Deccan has ordered 30 Airbus A320 planes in a $1.8bn (£931m) deal as India's first low-cost airline expands in the fast-growing domestic market.Beer magnate Vijay Mallya recently set up Kingfisher Airlines, while UK entrepreneur Richard Branson has said he is keen to start a local operation.Air Deccan was set up last year and wants to lure travellers away from the railway network and pricier rivals.The potential of the Indian market has attracted attention at home and abroad.","['deal', 'increase', 'recently', 'indian', '18bn', 'set', 'airlines', 'india', 'air', 'deccan']"
133,"""Members of the joint venture including Contrack are committed to the ongoing reconstruction efforts, are actively working in Iraq and continue to look for new construction opportunities in the country,"" it said in a statement.US firms and their workers have been targets of attacks, and security concerns are said to be a major reason for the slow pace of reconstruction in Iraq.A US company has pulled out of a major contract to rebuild Iraq's transport system after attacks on reconstruction efforts, Pentagon officials have said.Lt Col Eric Schnaible of the PCO told the Associated Press news agency Contrack's withdrawal from the transportation contract was a ""mutually agreed-to separation"" and did not indicate a movement by US companies to leave Iraq.Contrack said ""the original scope of work that was envisioned could not be executed in a cost-effective manner"".","['firms', 'said', 'major', 'work', 'attacks', 'pentagon', 'working', 'contract', 'reconstruction', 'iraq']"
134,"The US credit card to travel services giant said off-loading American Express Financial Advisors (AEFA) would boost its profitability.The unit was acquired by American Express 20 years ago as Investors Diversified Service, of Minneapolis, at a time when firms were amassing one-stop financial empires.Shares in American Express surged more than 8% on Tuesday after it said it was to spin off its less profitable financial advisory subsidiary.AEFA has more than 12,000 advisers selling financial advice, funds and insurance to 2.5 million customers.","['rest', 'profitable', 'years', 'travel', 'time', 'card', 'shares', 'selling', 'financial', 'american']"
135,"Brazil's unemployment rate fell to its lowest level in three years in December, according to the government.IBGE also said that average monthly salaries grew 1.9% in December 2004 from December 2003.The Brazilian Institute for Geography and Statistics (IBGE) said it fell to 9.6% in December from 10.6% in November and 10.9% in December 2003.The jobless rate average for the whole of 2004 was 11.5%, down from 12.3% in 2003, the IBGE said.The unemployment rate has been falling gradually since April 2004 when it reached a peak of 13.1%.However, average monthly wages fell 1.8% in December to 895.4 reais ($332; £179.3) from November.","['government', 'economic', '2003', 'jobless', '2004', 'fell', 'average', 'rate', 'december', 'unemployment']"
136,"Wimpey said the UK housing market had proved ""challenging"" last year.But B&B - which has a 22% share of the UK buy-to-let mortgage market - said that while rates of growth were moderating, the sector ""continues to grow at a rate considerably above that of the whole mortgage market"".B&B said the buy-to-let market - in which the bank is a major player - would continue to grow much faster than the wider mortgage market.Recent housing market surveys have indicated that the UK property market has cooled in recent months after several years of rapid growth.Overall, B&B said that ""housing market fundamentals remain strong"".The UK property market remains robust despite the recent slowdown, according to mortgage lender Bradford & Bingley and housebuilder George Wimpey.Wimpey reported a 19% rise in profits to £450.7m and said recent new home reservations were better than expected.","['slowdown', 'real', 'indicated', 'buy', 'recent', 'grow', 'uk', 'market', 'mortgage', 'housing']"
137,"With the Pension Benefit Guaranty Corporation (PBGC) some £23bn (£12m) in deficit, the Financial Economists Roundtable (FER) wants Congress to act.The company has an estimated $2.9bn hole in its pilots' pension scheme, which the PBGC will now guarantee.The FER says firms should not have been allowed to reduce the insurance premiums they pay into the PBGC fund.""With a little firmer hand on the pensions issues in the US, I think that Congress could avoid having to turn to the taxpayer and instead turn the obligations back onto the companies that deserve to pay them,"" said Professor Dennis Logue, dean of Price College of Business at the University of Oklahoma.Instead of taxpayers having to pick up the bill, the FER wants Congressmen to change the PBGC's funding rules.","['change', 'instead', 'having', 'insurance', 'deficit', 'scheme', 'wants', 'congress', 'pensions', 'pension']"
138,"In the three-months to January, like-for-like sales showed a growth rate of -0.1%, the same as in the three months to December, the BRC said.But clothing and footwear sales were said to be generally better than December, while department stores also had a good month.Stores received a boost from bargain hunters but trading then reverted to December levels, the British Retail Consortium and accountants KPMG said.Higher interest rates and uncertainty over the housing market continue to take their toll on the retail sector, the BRC said.The previous BRC survey found Christmas 2004 was the worst for 10 years for retailers.","['retail', 'month', 'worst', 'stores', 'survey', 'boost', 'failed', 'december', 'sales', 'like']"
139,"The owners of Rossignol, the Boix-Vives family, are said to be considering an offer from Quiksilver.The Boix-Vives family is thought to have spent the past couple of years sounding out possible suitors for Rossignol, which also makes golf equipment, snowboards and sports clothing.Analysts believe other sporting goods companies may now take a closer look at Rossignol, prompting an auction and pushing the sale price higher.Shares of Skis Rossignol, the world's largest ski-maker, have jumped as much as 15% on speculation that it will be bought by US surfwear firm Quiksilver.","['auction', 'analysts', 'sports', 'shares', 'higher', 'possible', 'euros', 'companies', 'goods', 'family']"
140,"Germany's unemployment figure rose above the psychologically important level of five million last month.""Yes, we have effectively more than five million people unemployed,"" a government minister said earlier on ZDF public television.On Wednesday, the German Federal Labour Agency said the jobless total had reached 5.037 million in January, which takes the jobless rate to 12.1%.It said there are a further 1.5 million-2 million people on subsidised employment schemes who are, in fact, looking for real jobs.But the figures are embarrassing for the government.The opposition also made political capital from the figures.","['german', 'germany', 'effect', 'figures', 'reforms', 'numbers', 'government', 'unemployment', 'jobless', 'million']"
141,"In 2001, the company set up a fund to compensate asbestos victims, but it later admitted the fund was running short of money.The move follows angry protests after the firm said a previous compensation fund was running out of money.The landmark deal could see thousands of people suffering from lung diseases - caused by asbestos the company once made - receive compensation.However, the deal still has to receive the approval of Hardie's shareholders.In September, the inquiry found that the company had misled the public about the amount of money set aside to cover its asbestos-related liabilities, sparking the resignation of its then chief executive, Peter MacDonald.Hardie, which currently makes more than 80% of its revenues in the US, was once Australia's biggest supplier of asbestos building materials.Australian building products group James Hardie has agreed to pay $1.1bn (£568m) to victims of asbestos-related diseases.","['deal', 'money', 'inquiry', 'public', 'company', 'fund', 'building', 'australia', 'compensation', 'victims']"
142,"""The retail sales figures are very weak, but as Bank of England governor Mervyn King indicated last night, you don't really get an accurate impression of Christmas trading until about Easter,"" said Mr Shaw.The last time retailers endured a tougher Christmas was 23 years previously, when sales plunged 1.7%.A number of retailers have already reported poor figures for December.Retail sales dropped by 1% on the month in December, after a 0.6% rise in November, the Office for National Statistics (ONS) said.Clothing retailers and non-specialist stores were the worst hit with only internet retailers showing any significant growth, according to the ONS.UK retail sales fell in December, failing to meet expectations and making it by some counts the worst Christmas since 1981.Yet, other retailers - including HMV, Monsoon, Jessops, Body Shop and Tesco - reported that festive sales were well up on last year.","['poor', 'england', 'december', 'sales', 'worst', 'ons', 'figures', 'christmas', 'retail', 'retailers']"
143,"GMAC has been a strong contributor to profits in 2004 but GM said it will do less well this year, delivering net income of $2.5bn.GM said it expects to meet its 2004 earnings targets ""despite a tough competitive environment"".GM said higher healthcare costs in North America, and lower profits at its financial services subsidiary would hurt its performance in 2005.GM said it was expecting ""reduced financial losses"" in Europe in 2005.It said it would deliver a shareholder payout of $6.0-$6.5 per share this year, as promised, but that next year's earnings per share would be lower, at between $4.0-$5.0.The car maker has diversified into financial services, and is extending the reach of General Motors Acceptance Corp (GMAC), which has said it may enter the home loans market.","['car', 'expects', 'profits', 'said', 'lower', '2004', 'share', 'losses', 'earnings', 'gm']"
144,"The CML said that loans for new property purchases fell 25% year-on-year to 85,000 - the lowest total seen since February 2003.CML figures showed gross lending fell by 4% in November as the number of people buying new homes fell.A swathe of figures have provided further evidence of a slowdown in the UK property market.The Council of Mortgage Lenders (CML), British Bankers Association (BBA) and Building Societies Association (BSA) all said mortgage lending was slowing.Data from the CML showed lending fell to just over £25bn in November, from £25.5bn a year earlier.""What is apparent is a picture of a slowing market, but one that should remain stable as we return to more normal volumes of lending over 2005 as a whole,"" CML director general Michael Coogan said.Rightmove said estate agents were set to enter 2005 with a third more properties on their books than a year ago.A host of mortgage lenders and economists have predicted that property prices will either fall or stagnate in 2005.","['slowing', 'showed', 'november', 'prices', 'market', 'figures', 'fell', 'property', 'lending', 'mortgage']"
145,"Vodafone and O2, Britain's other big mobile phone operator, were sent similar statements of objections by the Commission in July last year.The European Commission has written to the mobile phone operators Vodafone and T-Mobile to challenge ""the high rates"" they charge for international roaming.The Commission's investigation into Vodafone and Deutsche Telekom's T-Mobile centres on the tariffs the two companies charge foreign mobile operators to access their networks when subscribers of those foreign operators use their mobile phones in Germany.""The Commission aims to ensure that European consumers are not overcharged when they use their mobile phones on their travels around the European Union,"" the Commission said in a statement.Vodafone sent the Commission a response to those allegations in December last year and is now waiting for a reply.In letters sent to the two companies, the Commission alleged the firms were abusing their dominant market position in the German mobile phone market.The Vodafone spokesman said a similar process would be set in motion with these latest statement of objections about its operations in Germany.","['companies', 'spokesman', 'investigation', 'sent', 'charge', 'allegations', 'phone', 'mobile', 'commission', 'vodafone']"
146,"Therefore, it may be preferable for parents to contribute to the Child Trust Fund which is tax free, with any gifts from relatives that take the total above the annual £1,200 limit being directed to a deposit account.As the Child Trust Fund will not be in force in time for Christmas, relatives could invest their gifts in a higher rate children's deposit account, and use this as a feeder fund.If the account holds money gifted by friends and relatives - but not parents - any interest earned from the savings account may be set against the allowance.Where both parents and other relatives are saving on behalf of a child, consideration should be given to opening separate accounts - one for parents' gifts and one for gifts from other relatives.Interest earned by children is subject to income tax.The tax rules are different for parents who save on behalf of a child.There are accounts designed to start children off in the savings habit and they often pay a higher rate of interest.The only drawback with all financial gifts is that the children gain an absolute right to the money at age 18, and parents will have no control over how it is spent.This confirms that the account holder is a non-taxpayer and allows interest to be received without the deduction of income tax.The government is trying to encourage saving at an early age, through its new Child Trust Fund.Parents and relatives will be able to top up the fund with up to £1,200 a year, which will grow free of income and capital gains tax.Only £100 of interest (per parent) can be tax-free.It may encourage children to save or start a fund which could count towards university costs, for example.Where interest exceeds this level, the whole of the interest will be taxed on the parent.This is to prevent parents from holding their own cash savings in their children's names and taking advantage of the tax allowances.The parent or guardian will be responsible for the Bonds and will receive notification of the purchase.","['parent', 'trust', 'fund', 'income', 'relatives', 'account', 'tax', 'child', 'children', 'parents']"
147,"Oil prices carried on rising on Wednesday after cold weather on both sides of the North Atlantic pushed US crude prices to four-month highs.Declines in the dollar have also contributed to the rising oil price.Several Opec members said on Tuesday that a cut in production was unlikely, citing rising prices and strong demand for oil from Asia.Expectations that a rebound in the dollar would halt the oil price rise were not immediately borne out on Wednesday morning, as oil prices carried on upwards as the dollar strengthened against the euro, the pound and the yen.Freezing temperatures and heavy snowfalls took crude oil prices past $50 a barrel on Tuesday for the first time since November.A barrel of US crude oil closed up $2.80 at $51.15 in New York on Tuesday.","['opec', 'rising', 'wednesday', 'cut', 'tuesday', 'dollar', 'barrel', 'crude', 'oil', 'prices']"
148,"Mortgage lending rose by £7.1bn in December, up from a £6.4bn rise in November.Changes to mortgage regulation may have artificially depressed figures in November, thus flattering the December figures, analysts said.""The modest rise in mortgage approvals and lending in December reinforces the impression that the housing market is currently slowing steadily rather than sharply,"" said Global Insight analyst Howard Archer, commenting on the BoE's figures.Separately, the Bank of England said that consumer credit rose by £1.5bn in December, more than the £1.4bn expected and above the £1.4bn reported in the previous month.","['market', 'year', 'rules', 'england', 'rose', 'november', 'december', 'figures', 'mortgage', 'lending']"
149,"The value of trade in April-July rose to $186.3m (£97m) from $64.4m in the same period in 2003, the Indian Government said.""If the positive trend continues, two-way trade could well cross half a billion dollars this fiscal year,"" India's federal commerce Minister Kamal Nath said.Calmer relations between India and Pakistan are paying economic dividends, with new figures showing bilateral trade up threefold in the summer.According to official data, the value of India's overall exports in the current fiscal year is expected to reach more than $60bn, while in Pakistan's case it is set to hit more than $12bn.Meanwhile, the Indian Government said the prospects for the country's booming economy remained ""very bright"" despite a ""temporary aberration"" this year.","['figures', 'value', 'year', 'overall', 'april', 'fiscal', 'indian', 'exports', 'trade', 'india']"
150,"The revelation came as the Russian government said Rosneft had signed a long-term oil supply deal with China.""The two companies [Rosneft and CNPC] have agreed on the pre-payment for long-term deliveries,"" said Russian oil official Sergei Oganesyan.The Kremlin said on Tuesday that the $6bn which Russian state bank VEB lent state-owned Rosneft to help buy Yugansk in turn came from Chinese banks.The deal between Rosneft and CNPC is seen as part of China's desire to secure long-term oil supplies to feed its booming economy.The deal sees Rosneft receive $6bn in credits from China's CNPC.Reports said CNPC had been offered 20% of Yugansk in return for providing finance but the company opted for a long-term oil supply deal instead.China lent Russia $6bn (£3.2bn) to help the Russian government renationalise the key Yuganskneftegas unit of oil group Yukos, it has been revealed.But Yugansk was sold to a little known shell company which in turn was bought by Rosneft.Yugansk was sold for $9.3bn in an auction last year to help Yukos pay off part of a $27bn bill in unpaid taxes and fines.","['term', 'help', 'deal', 'chinese', 'china', 'yukos', 'oil', 'russian', 'yugansk', 'rosneft']"
151,"Australian brewer Fosters has bought a large stake in Australian winemaker Southcorp, sparking rumours of a possible takeover.Fosters bought 18.8% of Southcorp, the global winemaker behind the Penfolds, Lindemans and Rosemount brands, for 4.17 Australian dollars per share.Fosters bought the 18.8% stake from Reline Investments, the family investment firm for the Oatleys, who founded the Rosemount Estates label and sold it to Southcorp in 2001.Since then, it has paid $1bn for US wine maker Robert Mondavi, bought last month.Fosters has done a back-flip"", said Shawn Burns, a fund manger at Deutsche Asset Management.Fosters said it was currently in discussions ""which may lead to a major corporate announcement"".Analysts were divided on Thursday about whether Fosters was more likely to go for a takeover or merely wanted to take a big enough chunk of Southcorp to prevent it falling to a rival.The prospect of Fosters launching a major acquisition startled investors, as the brewer said last summer that it was not looking to expand through a big buy in the near future.Fosters' main wine business is Beringer Blass Wine Estate.Southcorp's shares have risen in recent months on speculation that it could become a takeover target.","['shares', 'asked', '1bn', 'stake', 'bought', 'takeover', 'australian', 'wine', 'southcorp', 'fosters']"
152,"Japan's Sumitomo Mitsui Financial has withdrawn its takeover offer for rival bank UFJ Holdings, enabling the latter to merge with Mitsubishi Tokyo.Sumitomo, Japan's third-largest bank, tabled a higher offer for UFJ than its rival, valuing the company at $35bn.However, UFJ's management was known to prefer the offer from Mitsubishi Tokyo Financial Group (MTFG), Japan's second-largest bank.UFJ Holdings, Japan's fourth-largest bank, has been at the centre of a fierce bid battle over the last year.Sumitomo bosses told counterparts at UFJ of its decision on Friday, clearing the way for it to conclude a 3 trillion yen ($29bn) deal with Mitsubishi.Mitsubishi's takeover of UFJ - which will be Japan's largest-ever takeover deal - will still have to be approved by shareholders of the two firms.","['merge', 'takeover', 'offer', 'largest', 'trillion', 'bank', 'japanese', 'japan', 'mitsubishi', 'ufj']"
153,"Mr Sullivan, 42, has already pleaded guilty to fraud and will be sentenced following Mr Ebbers' trial, where he is appearing as a prosecution witness.Mr Sullivan has spent two days being cross-examined by lawyers for former Worldcom chief executive Mr Ebbers.Mr Ebbers is on trial for fraud and conspiracy in relation to WorldCom's collapse in 2002.Mr Ebbers, 63, has always insisted that he was unaware of any hidden shortfalls in WorldCom's finances.Attorney Reid Weingarten has attempted to portray Mr Sullivan as a liar and on Thursday quizzed him about his decision to commit fraud to meet analysts' profit estimates.The former finance officer said Mr Ebbers knew about the improper accounting entries that were made between 2000 and 2002 to conceal soaring expenses and inflate revenue.","['evidence', 'mci', 'collapse', 'guilty', 'trial', 'fraud', 'mr', 'sullivan', 'worldcom', 'ebbers']"
154,"Mr Fischer will face a delicate balancing act - both in political and economic terms - between Mr Sharon and finance minister Binyamin Netanyahu, who also backed his nomination.But his appointment has also raised hopes that it could bring in fresh investment - and perhaps even an improvement in the country's credit rating Mr Fischer first went to Israel for six months in 1973, and almost emigrated there before deciding finally to return to the US.Stanley Fischer, vice chairman of banking giant Citigroup, has agreed to take the Bank of Israel job subject to approval from parliament and cabinet.Israel has asked a US banker and former International Monetary Fund director to run its central bank.Mr Fischer, who speaks fluent Hebrew, will have to become an Israeli citizen to take the job.","['package', 'citigroup', 'economy', 'economic', 'minister', 'finance', 'job', 'mr', 'bank', 'israel']"
155,"The budget deficit hit a record $412bn in the 12 months to 30 September 2004, after reaching $377bn in the previous fiscal year.The US budget deficit is set to hit a worse-than-expected $368bn (£197bn) this year, officials said on Tuesday.Past Congressional Budget Office (CBO) forecasts said there would be a $348bn shortfall in the 2005 fiscal year.The cost of military operations still needs to be factored in, with analysts saying the deficit could end up a further $100bn in the red.The CBO also forecast a total shortfall of $855bn for the years from 2006 to 2015, an improvement on previous projections.In November, the gap between US exports and imports widened to more than $60bn, a record figure.","['administration', 'iraq', 'president', 'costs', 'previous', 'fiscal', 'operations', 'military', 'budget', 'deficit']"
156,"The economy has grown for six quarters but growth slowed dramatically in the last quarter amid weaker global demand.Japanese industrial output fell in October while unemployment rose, casting further doubt on the strength of the country's economic recovery.Analysts had been forecasting a 0.1% rise in month on month industrial output.According to figures from the Ministry of Economy, Trade and Industry (METI), the decline was led by a fall in demand for electronic parts for mobile phones and digital televisions.Although inventories fell 0.7% month on month, they were 36% higher than a year ago.Japanese government officials played down the latest data, arguing that domestic consumer demand was still resilient.","['01', 'quarter', 'october', 'economy', 'demand', 'output', 'japan', 'unemployment', 'industrial', 'month']"
157,"Despite a short-lived increase in Palestinian jobs in 2003, the economy is performing well below its potential, said a World Bank report.According to the report, Intifada, Closures and Palestinian Economic Crisis: An Assessment, there is a close link between the number of closures - both border closures and internal closures between cities - and Palestinian economic problems.However, during the first half of this year, the Palestinian economy lost more than 22,000 jobs.The report said even more would be on the poverty line without an average of $950m a year from international donors, some of which goes towards job creation.Young people are particularly hard hit with 37% out of work, compared with 14% four years ago.But 104,000 new jobs were created last year during a brief easing of violence and closures.","['line', 'particularly', 'jobs', 'poverty', 'crisis', 'economic', 'bank', 'report', 'west', 'palestinian']"
